Sheet: Sheet1
A1: focus area | B1: entity | C1: Total | D1: Category | E1: hexcolor | F1: year2005 | G1: year2006 | H1: year2007 | I1: year2008 | J1: year2009 | K1: year2010 | L1: year2011 | M1: year2012 | N1: year2013 | O1: year2014
A2: Local Taxes | B2: City | C2: =SUM(RC[3]:RC[12]) -> 826476357 | D2: Revenue | E2: #2DF7AA | F2: 66630057 | G2: 70460607 | H2: 76003607 | I2: 83959949 | J2: 89056610 | K2: 87539844 | L2: 85790966 | M2: 87957960 | N2: 88997921 | O2: 90078836
A3: Licenses & Permits | B3: City | C3: =SUM(RC[3]:RC[12]) -> 72133727 | D3: Revenue | E3: #2DF7AA | F3: 5570000 | G3: 5949682 | H3: 6225130 | I3: 7401130 | J3: 7425630 | K3: 7162430 | L3: 7622375 | M3: 7908668 | N3: 8044000 | O3: 8824682
A4: Intergov't Revenue | B4: City | C4: =SUM(RC[3]:RC[12]) -> 133848549 | D4: Revenue | E4: #2DF7AA | F4: 12215138 | G4: 12273414 | H4: 13260465 | I4: 14138433 | J4: 14143827 | K4: 13905983 | L4: 13124744 | M4: 13018946 | N4: 13408252 | O4: 14359347
A5: Charges for Services | B5: City | C5: =SUM(RC[3]:RC[12]) -> 135608425 | D5: Revenue | E5: #2DF7AA | F5: 12026694 | G5: 11863750 | H5: 12491797 | I5: 13399086 | J5: 14213253 | K5: 13596826 | L5: 13619121 | M5: 14081330 | N5: 14893637 | O5: 15422931
A6: Fines | B6: City | C6: =SUM(RC[3]:RC[12]) -> 4500000 | D6: Revenue | E6: #2DF7AA | F6: 405000 | G6: 405000 | H6: 405000 | I6: 405000 | J6: 405000 | K6: 405000 | L6: 500000 | M6: 500000 | N6: 500000 | O6: 570000
A7: Misc. Revenue | B7: City | C7: =SUM(RC[3]:RC[12]) -> 15761003 | D7: Revenue | E7: #2DF7AA | F7: 660000 | G7: 1052571 | H7: 1624391 | I7: 2146801 | J7: 2114251 | K7: 1794519 | L7: 1639864 | M7: 1749822 | N7: 1593051 | O7: 1385733
A8: City/County Rev. Sharing | B8: City | C8: =SUM(RC[3]:RC[12]) -> 143764005 | D8: Revenue | E8: #2DF7AA | F8: 8004461 | G8: 9742748 | H8: 10134816 | I8: 13212401 | J8: 13633950 | K8: 18038878 | L8: 18454658 | M8: 18089812 | N8: 17520948 | O8: 16931333
A9: Carryover Funds | B9: City | C9: =SUM(RC[3]:RC[12]) -> 905778 | D9: Revenue | E9: #2DF7AA | J9: - | K9: - | L9: - | M9: - | N9: 790778 | O9: 115000
A10: Transfers from Other Funds | B10: City | C10: =SUM(RC[3]:RC[12]) -> 1001323 | D10: Revenue | E10: #2DF7AA | J10: - | K10: - | L10: - | M10: - | N10: 521323 | O10: 480000
A11: Total revenue: | B11: City | C11: =SUM(RC[3]:RC[12]) -> 1333999167 | D11: Revenue | E11: #2DF7AA | F11: =SUM(R[-9]C:R[-1]C) -> 105511350 | G11: =SUM(R[-9]C:R[-1]C) -> 111747772 | H11: =SUM(R[-9]C:R[-1]C) -> 120145206 | I11: =SUM(R[-9]C:R[-1]C) -> 134662800 | J11: =SUM(R[-9]C:R[-1]C) -> 140992521 | K11: =SUM(R[-9]C:R[-1]C) -> 142443480 | L11: =SUM(R[-9]C:R[-1]C) -> 140751728 | M11: =SUM(R[-9]C:R[-1]C) -> 143306538 | N11: =SUM(R[-9]C:R[-1]C) -> 146269910 | O11: =SUM(R[-9]C:R[-1]C) -> 148167862
A12: Management | B12: City | C12: =SUM(RC[3]:RC[12]) -> 34397839 | D12: Expenditure | E12: #4FC6C6 | F12: 4793310 | G12: 2727899 | H12: 2864790 | I12: 3077641 | J12: 3227844 | K12: 3421192 | L12: 3479972 | M12: 3453169 | N12: 3515905 | O12: 3836117
A13: Employee Compensation/Training | B13: City | C13: =SUM(RC[3]:RC[12]) -> 7504007 | D13: Expenditure | E13: #4FC6C6 | F13: 1648578 | G13: 1564225 | H13: 1364980 | I13: 1817064 | J13: 80000 | K13: 146000 | L13: 180915 | M13: 271415 | N13: 260415 | O13: 170415
A14: Debt Service | B14: City | C14: =SUM(RC[3]:RC[12]) -> 27973487 | D14: Expenditure | E14: #4FC6C6 | F14: 5350000 | G14: 5775000 | H14: 5714000 | I14: 5932000 | J14: 1791960 | K14: 445000 | L14: 495000 | M14: 1140527 | N14: 695000 | O14: 635000
A15: Fund Balance Target Adj. | B15: City | C15: =SUM(RC[3]:RC[12]) -> 40787896 | D15: Expenditure | E15: #4FC6C6 | F15: 200000 | G15: 400000 | H15: 323702 | I15: 330194 | J15: 6150000 | K15: 6692000 | L15: 6392000 | M15: 6700000 | N15: 7050000 | O15: 6550000
A16: Internal Services | B16: City | C16: =SUM(RC[3]:RC[12]) -> 6369906 | D16: Expenditure | E16: #4FC6C6 | F16: - | G16: 1158717 | H16: 1206785 | I16: 1204404 | J16: 500000 | K16: 500000 | L16: 500000 | M16: 500000 | N16: 500000 | O16: 300000
A17: Financial Services | B17: City | C17: =SUM(RC[3]:RC[12]) -> 18888613 | D17: Expenditure | E17: #4FC6C6 | F17: - | G17: 3378875 | H17: 3591651 | I17: 3934675 | J17: 1305324 | K17: 1304478 | L17: 1313247 | M17: 1305265 | N17: 1376182 | O17: 1378916
A18: Business Services/Technology | B18: City | C18: =SUM(RC[3]:RC[12]) -> 28968632 | D18: Expenditure | E18: #4FC6C6 | F18: 3455799 | G18: - | H18: - | I18: - | J18: 4095991 | K18: 4168059 | L18: 4209841 | M18: 4236608 | N18: 4405325 | O18: 4397009
A19: Healthy Families/Community | B19: City | C19: =SUM(RC[3]:RC[12]) -> 223818375 | D19: Expenditure | E19: #4FC6C6 | F19: 14889745 | G19: 17952419 | H19: 19968390 | I19: 22774985 | J19: 24088316 | K19: 24373529 | L19: 23991343 | M19: 24760367 | N19: 25178973 | O19: 25840308
A20: Infrastructure/Transportation | B20: City | C20: =SUM(RC[3]:RC[12]) -> 135703474 | D20: Expenditure | E20: #4FC6C6 | F20: 15069686 | G20: 14828209 | H20: 12004928 | I20: 13423256 | J20: 14466193 | K20: 13468761 | L20: 12867252 | M20: 12751780 | N20: 13363570 | O20: 13459839
A21: Public Safety/Justice | B21: City | C21: =SUM(RC[3]:RC[12]) -> 309684193 | D21: Expenditure | E21: #4FC6C6 | F21: 24400207 | G21: 26099903 | H21: 28661073 | I21: 31319936 | J21: 31887986 | K21: 32244160 | L21: 32491252 | M21: 33324127 | N21: 34358885 | O21: 34896664
A22: School Operations (local funds) | B22: City | C22: =SUM(RC[3]:RC[12]) -> 384138849 | D22: Expenditure | E22: #4FC6C6 | F22: 30620025 | G22: 32100025 | H22: 34012025 | I22: 38340609 | J22: 39781531 | K22: 40209612 | L22: 40080523 | M22: 41820475 | N22: 43106198 | O22: 44067826
A23: Designated Expenditures | B23: City | C23: =SUM(RC[3]:RC[12]) -> 109687016 | D23: Expenditure | E23: #4FC6C6 | F23: 5084000 | G23: 5762500 | H23: 10432882 | I23: 12508036 | J23: 13617376 | K23: 12674884 | L23: 11954578 | M23: 12557535 | N23: 12459457 | O23: 12635768
A24: Economic Downturn Fund | B24: City | C24: =SUM(RC[3]:RC[12]) -> 6076880 | D24: Expenditure | E24: #4FC6C6 | F24: - | G24: - | H24: - | I24: - | J24: - | K24: 2795805 | L24: 2795805 | M24: 485270 | N24: - | O24: -
A25: Total expenditures | B25: City | C25: =SUM(RC[3]:RC[12]) -> 1333999167 | D25: Expenditure | E25: #4FC6C6 | F25: =SUM(R[-13]C:R[-1]C) -> 105511350 | G25: =SUM(R[-13]C:R[-1]C) -> 111747772 | H25: 120145206 | I25: 134662800 | J25: 140992521 | K25: 142443480 | L25: 140751728 | M25: 143306538 | N25: 146269910 | O25: =SUM(R[-13]C:R[-1]C) -> 148167862
A43: Source: City of Charlottesville Budget Office
A45: City of Charlottesville
A47: GENERAL FUND BUDGET TRENDS BY MAJOR CATEGORY
A49: Fiscal Year 2005 - 2014
A93: Source: City of Charlottesville Budget Office
A95: City of Charlottesville
A97: GENERAL FUND BUDGET TRENDS BY MAJOR CATEGORY
A99: Fiscal Year 2005 - 2014